{
  "schema_version": "1.0",
  "pack_id": "formulatracer.physics-foundation.v1",
  "definitions": [
    {"definition_id":"gradient","name":"Gradient by partial derivatives","expression":{"op":"Gradient","function":{"op":"PatternVariable","name":"f"}},"expansion":{"op":"IndexedValue","name":"grad_f","indices":["i"],"definition":{"op":"Derivative","function":{"op":"PatternVariable","name":"f"},"variable":{"op":"IndexedValue","name":"x","indices":["i"]}}},"references":["ref.vector-calculus"]},
    {"definition_id":"jacobian","name":"Jacobian by component partials","expression":{"op":"Jacobian","function":{"op":"PatternVariable","name":"F"}},"expansion":{"op":"IndexedValue","name":"J_F","indices":["i","j"],"definition":{"op":"Derivative","function":{"op":"IndexedValue","name":"F","indices":["i"]},"variable":{"op":"IndexedValue","name":"x","indices":["j"]}}},"references":["ref.multivariable-calculus"]},
    {"definition_id":"hessian","name":"Hessian by mixed partials","expression":{"op":"Hessian","function":{"op":"PatternVariable","name":"f"}},"expansion":{"op":"IndexedValue","name":"H_f","indices":["i","j"],"definition":{"op":"Derivative","order":2,"function":{"op":"PatternVariable","name":"f"},"variables":["x_i","x_j"]}},"references":["ref.multivariable-calculus"]},
    {"definition_id":"directional_derivative","name":"Directional derivative","expression":{"op":"DirectionalDerivative","function":{"op":"PatternVariable","name":"f"},"direction":{"op":"PatternVariable","name":"v"}},"expansion":{"op":"Dot","args":[{"op":"PatternVariable","name":"v"},{"op":"Gradient","function":{"op":"PatternVariable","name":"f"}}]},"references":["ref.vector-calculus"]},
    {"definition_id":"divergence","name":"Cartesian divergence","expression":{"op":"Divergence","field":{"op":"PatternVariable","name":"F"}},"expansion":{"op":"FiniteSum","bound_index":"i","body":{"op":"Derivative","function":{"op":"IndexedValue","name":"F","indices":["i"]},"variable":{"op":"IndexedValue","name":"x","indices":["i"]}}},"references":["ref.vector-calculus"]},
    {"definition_id":"curl_r3","name":"Right-handed Cartesian curl","expression":{"op":"Curl","field":{"op":"PatternVariable","name":"F"},"orientation":"RIGHT_HANDED"},"expansion":{"op":"IndexedValue","name":"curl_F","indices":["i"],"definition":{"op":"FiniteSum","bound_indices":["j","k"],"body":{"op":"Multiply","args":[{"op":"LeviCivita","indices":["i","j","k"]},{"op":"Derivative","function":{"op":"IndexedValue","name":"F","indices":["k"]},"variable":{"op":"IndexedValue","name":"x","indices":["j"]}}]}}},"assumptions":["three_dimensional_cartesian","right_handed_orientation"],"references":["ref.vector-calculus"]},
    {"definition_id":"laplacian","name":"Laplacian as divergence of gradient","expression":{"op":"Laplacian","function":{"op":"PatternVariable","name":"f"}},"expansion":{"op":"Divergence","field":{"op":"Gradient","function":{"op":"PatternVariable","name":"f"}}},"references":["ref.vector-calculus"]},
    {"definition_id":"flux_integral","name":"Oriented flux integral","expression":{"op":"FluxIntegral","field":{"op":"PatternVariable","name":"F"},"surface":{"op":"PatternVariable","name":"S"}},"expansion":{"op":"Integral","domain":{"op":"PatternVariable","name":"S"},"measure":"SURFACE","orientation":{"op":"PatternVariable","name":"orientation"},"body":{"op":"Dot","args":[{"op":"PatternVariable","name":"F"},{"op":"SurfaceNormal"}]}},"references":["ref.stokes"]},
    {"definition_id":"action","name":"Action functional","expression":{"op":"Action","path":{"op":"PatternVariable","name":"q"}},"expansion":{"op":"Integral","variable":"t","body":{"op":"Lagrangian","args":[{"op":"PatternVariable","name":"q"},{"op":"Derivative","function":{"op":"PatternVariable","name":"q"},"variable":"t"},{"op":"FreeVariable","name":"t"}]}},"references":["ref.variational-calculus"]},
    {"definition_id":"poisson_bracket","name":"Canonical Poisson bracket","expression":{"op":"PoissonBracket","args":[{"op":"PatternVariable","name":"f"},{"op":"PatternVariable","name":"g"}]},"expansion":{"op":"FiniteSum","bound_index":"i","body":{"op":"Subtract","args":[{"op":"Multiply","args":[{"op":"Derivative","function":{"op":"PatternVariable","name":"f"},"variable":"q_i"},{"op":"Derivative","function":{"op":"PatternVariable","name":"g"},"variable":"p_i"}]},{"op":"Multiply","args":[{"op":"Derivative","function":{"op":"PatternVariable","name":"f"},"variable":"p_i"},{"op":"Derivative","function":{"op":"PatternVariable","name":"g"},"variable":"q_i"}]}]}},"references":["ref.hamiltonian-mechanics"]},
    {"definition_id":"conservation_law","name":"Local conservation law","expression":{"op":"ConservationLaw","density":{"op":"PatternVariable","name":"rho"},"flux":{"op":"PatternVariable","name":"J"}},"expansion":{"op":"Equation","lhs":{"op":"Add","args":[{"op":"Derivative","function":{"op":"PatternVariable","name":"rho"},"variable":"t"},{"op":"Divergence","field":{"op":"PatternVariable","name":"J"}}]},"rhs":{"op":"Constant","value":0}},"references":["ref.conservation-law"]},
    {"definition_id":"so3","name":"Special orthogonal rotation","expression":{"op":"Rotation","representation":{"op":"PatternVariable","name":"R"}},"expansion":{"op":"Predicate","args":[{"op":"Equation","lhs":{"op":"MatMul","args":[{"op":"Transpose","args":[{"op":"PatternVariable","name":"R"}]},{"op":"PatternVariable","name":"R"}]},"rhs":{"op":"IdentityMatrix"}},{"op":"Equation","lhs":{"op":"Determinant","args":[{"op":"PatternVariable","name":"R"}]},"rhs":{"op":"Constant","value":1}}]},"references":["ref.rotation"]},
    {"definition_id":"se3","name":"Rigid transform","expression":{"op":"RigidTransform","rotation":{"op":"PatternVariable","name":"R"},"translation":{"op":"PatternVariable","name":"t"}},"expansion":{"op":"HomogeneousMatrix","blocks":[{"op":"PatternVariable","name":"R"},{"op":"PatternVariable","name":"t"},{"op":"Constant","value":1}]},"assumptions":["R_in_SO3"],"references":["ref.rotation"]}
  ],
  "theorems": [
    {"theorem_id":"mixed_partial_symmetry","name":"Schwarz mixed-partial theorem","lhs":{"op":"Derivative","function":{"op":"PatternVariable","name":"f"},"variables":["x","y"]},"rhs":{"op":"Derivative","function":{"op":"PatternVariable","name":"f"},"variables":["y","x"]},"relation":"EXACT_UNDER_ASSUMPTIONS","assumptions":["continuous_second_partials_on_neighborhood"],"formalization_level":"THEOREM_REGISTERED","lean_theorem":null,"references":["ref.multivariable-calculus"]},
    {"theorem_id":"multivariable_chain_rule","name":"Multivariable chain rule","lhs":{"op":"Derivative","function":{"op":"FunctionComposition","args":[{"op":"PatternVariable","name":"F"},{"op":"PatternVariable","name":"G"}]}},"rhs":{"op":"MatMul","args":[{"op":"Jacobian","function":{"op":"PatternVariable","name":"F"}},{"op":"Jacobian","function":{"op":"PatternVariable","name":"G"}}]},"relation":"EXACT_UNDER_ASSUMPTIONS","assumptions":["F_differentiable","G_differentiable","domain_composable"],"formalization_level":"THEOREM_REGISTERED","lean_theorem":null,"references":["ref.multivariable-calculus"]},
    {"theorem_id":"curl_gradient_zero","name":"Curl of a gradient","lhs":{"op":"Curl","field":{"op":"Gradient","function":{"op":"PatternVariable","name":"f"}}},"rhs":{"op":"ZeroVector"},"relation":"EXACT_UNDER_ASSUMPTIONS","assumptions":["continuous_second_partials","simply_defined_cartesian_chart"],"formalization_level":"LEAN_KERNEL_VERIFIED","lean_theorem":"CppAudit.Physics.curlGradientZero","references":["ref.vector-calculus"]},
    {"theorem_id":"divergence_curl_zero","name":"Divergence of a curl","lhs":{"op":"Divergence","field":{"op":"Curl","field":{"op":"PatternVariable","name":"F"}}},"rhs":{"op":"Constant","value":0},"relation":"EXACT_UNDER_ASSUMPTIONS","assumptions":["continuous_second_partials","three_dimensional_cartesian"],"formalization_level":"LEAN_KERNEL_VERIFIED","lean_theorem":"CppAudit.Physics.divergenceCurlZero","references":["ref.vector-calculus"]},
    {"theorem_id":"gauss_divergence","name":"Gauss divergence theorem","lhs":{"op":"Integral","domain":{"op":"PatternVariable","name":"V"},"body":{"op":"Divergence","field":{"op":"PatternVariable","name":"F"}}},"rhs":{"op":"FluxIntegral","surface":{"op":"Boundary","domain":{"op":"PatternVariable","name":"V"}},"field":{"op":"PatternVariable","name":"F"}},"relation":"EXACT_UNDER_ASSUMPTIONS","assumptions":["F_continuously_differentiable","V_bounded_regular_domain","outward_boundary_orientation"],"formalization_level":"THEOREM_REGISTERED","lean_theorem":null,"references":["ref.gauss"]},
    {"theorem_id":"stokes","name":"Stokes theorem","lhs":{"op":"SurfaceIntegral","surface":{"op":"PatternVariable","name":"S"},"body":{"op":"Curl","field":{"op":"PatternVariable","name":"F"}}},"rhs":{"op":"LineIntegral","curve":{"op":"Boundary","domain":{"op":"PatternVariable","name":"S"}},"field":{"op":"PatternVariable","name":"F"}},"relation":"EXACT_UNDER_ASSUMPTIONS","assumptions":["F_continuously_differentiable","S_orientable_regular_surface","boundary_orientation_compatible"],"formalization_level":"THEOREM_REGISTERED","lean_theorem":null,"references":["ref.stokes"]},
    {"theorem_id":"euler_lagrange","name":"Euler-Lagrange necessary condition","lhs":{"op":"StationaryAction","path":{"op":"PatternVariable","name":"q"}},"rhs":{"op":"Equation","lhs":{"op":"Subtract","args":[{"op":"Derivative","function":{"op":"Derivative","function":{"op":"Lagrangian"},"variable":"qdot"},"variable":"t"},{"op":"Derivative","function":{"op":"Lagrangian"},"variable":"q"}]},"rhs":{"op":"Constant","value":0}},"relation":"EXACT_UNDER_ASSUMPTIONS","assumptions":["admissible_variations","fixed_endpoint_variation","L_twice_differentiable"],"formalization_level":"THEOREM_REGISTERED","lean_theorem":null,"references":["ref.variational-calculus"]},